<?xml version="1.0" encoding="UTF-8" standalone="yes"?>
<nucleus8583-oim xmlns="http://www.nucleus8583.org/schema/nucleus8583-oim"
                 xmlns:xsi="http://www.w3.org/2001/XMLSchema-instance"
                 xsi:schemaLocation="http://www.nucleus8583.org/schema/nucleus8583-oim 
                                     http://www.nucleus8583.org/schema/nucleus8583-oim.xsd">
    
    <complex-type name="details" class="java.util.HashMap" access="VIRTUAL">
        <basic name="z" type="text" length="8" />
    </complex-type>
    
	<message name="msg1" class="java.util.HashMap" access="VIRTUAL">
		<expression no="0" type="text" language="literal">0110</expression>
		<basic no="2" name="cardNumber" type="text" />
		<basic no="7" name="transmissionDateTime" type="dateTime" pattern="MMddHHmmss" />
		<basic no="11" name="stan" type="int" />
		<basic no="12" name="transactionTime" type="dateTime" pattern="HHmmss" />
		<basic no="13" name="transactionDate" type="dateTime" pattern="MMdd" />
        
		<record no="29" mode="text">
			<pad padWith="C" mode="text" />
			<basic name="charge" type="signedNumeric" length="8" precision="2" signFirst="false" />
		</record>
        
		<basic no="37" name="rrn" type="text" />
		<basic no="39" name="responseCode" type="text" />
		
        <record no="48" mode="text">
            <list-count name="details" type="int" length="2" />
            <list name="details" type="details" />
        </record>
	</message>
    
    <message name="msg1_rev" class="java.util.HashMap" access="VIRTUAL">
        <basic no="2" name="cardNumber" type="text" />
        <basic no="7" name="transmissionDateTime" type="dateTime" pattern="MMddHHmmss" />
        <basic no="11" name="stan" type="int" alignment="right" padWith="0" />
        <basic no="12" name="transactionTime" type="dateTime" pattern="HHmmss" />
        <basic no="13" name="transactionDate" type="dateTime" pattern="MMdd" />
        
        <record no="29" mode="text">
            <skip length="1" />
            <basic name="charge" type="signedNumeric" length="8" precision="2" signFirst="false" />
        </record>
        
        <basic no="37" name="rrn" type="text" />
        <basic no="39" name="responseCode" type="text" />
        
        <record no="48" mode="text">
            <list-count name="details" type="int" length="2" />
            <list name="details" type="details" />
        </record>
    </message>
</nucleus8583-oim>
